{
  "controlSchema": "requirement-assessment.schema.json",
  "recordId": "REQA-PREFILLED-157",
  "recordType": "REQUIREMENT_ASSESSMENT_REGISTER",
  "schemaVersion": "0.3.0",
  "programInstanceId": "IRP-EXAMPLE-001",
  "version": "0.1.0",
  "status": "DRAFT",
  "createdAt": "2026-07-19T15:57:13Z",
  "createdBy": "janumi-corpus-generator",
  "repositoryRevision": "UNASSESSED",
  "assessments": [
    {
      "assessmentId": "REQA-JAN-REQ-GOV-001",
      "requirementId": "JAN-REQ-GOV-001",
      "applicability": "APPLICABILITY_UNKNOWN",
      "conformanceStatus": "UNKNOWN",
      "assessmentConfidence": "UNKNOWN",
      "currentImplementationSummary": "UNASSESSED",
      "implementationReferences": [],
      "testReferences": [],
      "runtimeEvidenceReferences": [],
      "evidenceIds": [],
      "semanticAnalysis": "UNASSESSED",
      "gapDescription": "UNASSESSED",
      "discrepancyIds": [],
      "recommendedDisposition": "UNASSESSED",
      "assessedBy": "UNASSIGNED",
      "reviewedBy": "UNASSIGNED",
      "assessmentDate": "2026-07-19T15:54:56Z"
    },
    {
      "assessmentId": "REQA-JAN-REQ-GOV-002",
      "requirementId": "JAN-REQ-GOV-002",
      "applicability": "APPLICABILITY_UNKNOWN",
      "conformanceStatus": "UNKNOWN",
      "assessmentConfidence": "UNKNOWN",
      "currentImplementationSummary": "UNASSESSED",
      "implementationReferences": [],
      "testReferences": [],
      "runtimeEvidenceReferences": [],
      "evidenceIds": [],
      "semanticAnalysis": "UNASSESSED",
      "gapDescription": "UNASSESSED",
      "discrepancyIds": [],
      "recommendedDisposition": "UNASSESSED",
      "assessedBy": "UNASSIGNED",
      "reviewedBy": "UNASSIGNED",
      "assessmentDate": "2026-07-19T15:54:56Z"
    },
    {
      "assessmentId": "REQA-JAN-REQ-GOV-003",
      "requirementId": "JAN-REQ-GOV-003",
      "applicability": "APPLICABILITY_UNKNOWN",
      "conformanceStatus": "UNKNOWN",
      "assessmentConfidence": "UNKNOWN",
      "currentImplementationSummary": "UNASSESSED",
      "implementationReferences": [],
      "testReferences": [],
      "runtimeEvidenceReferences": [],
      "evidenceIds": [],
      "semanticAnalysis": "UNASSESSED",
      "gapDescription": "UNASSESSED",
      "discrepancyIds": [],
      "recommendedDisposition": "UNASSESSED",
      "assessedBy": "UNASSIGNED",
      "reviewedBy": "UNASSIGNED",
      "assessmentDate": "2026-07-19T15:54:56Z"
    },
    {
      "assessmentId": "REQA-JAN-REQ-GOV-004",
      "requirementId": "JAN-REQ-GOV-004",
      "applicability": "APPLICABILITY_UNKNOWN",
      "conformanceStatus": "UNKNOWN",
      "assessmentConfidence": "UNKNOWN",
      "currentImplementationSummary": "UNASSESSED",
      "implementationReferences": [],
      "testReferences": [],
      "runtimeEvidenceReferences": [],
      "evidenceIds": [],
      "semanticAnalysis": "UNASSESSED",
      "gapDescription": "UNASSESSED",
      "discrepancyIds": [],
      "recommendedDisposition": "UNASSESSED",
      "assessedBy": "UNASSIGNED",
      "reviewedBy": "UNASSIGNED",
      "assessmentDate": "2026-07-19T15:54:56Z"
    },
    {
      "assessmentId": "REQA-JAN-REQ-GOV-005",
      "requirementId": "JAN-REQ-GOV-005",
      "applicability": "APPLICABILITY_UNKNOWN",
      "conformanceStatus": "UNKNOWN",
      "assessmentConfidence": "UNKNOWN",
      "currentImplementationSummary": "UNASSESSED",
      "implementationReferences": [],
      "testReferences": [],
      "runtimeEvidenceReferences": [],
      "evidenceIds": [],
      "semanticAnalysis": "UNASSESSED",
      "gapDescription": "UNASSESSED",
      "discrepancyIds": [],
      "recommendedDisposition": "UNASSESSED",
      "assessedBy": "UNASSIGNED",
      "reviewedBy": "UNASSIGNED",
      "assessmentDate": "2026-07-19T15:54:56Z"
    },
    {
      "assessmentId": "REQA-JAN-REQ-GOV-006",
      "requirementId": "JAN-REQ-GOV-006",
      "applicability": "APPLICABILITY_UNKNOWN",
      "conformanceStatus": "UNKNOWN",
      "assessmentConfidence": "UNKNOWN",
      "currentImplementationSummary": "UNASSESSED",
      "implementationReferences": [],
      "testReferences": [],
      "runtimeEvidenceReferences": [],
      "evidenceIds": [],
      "semanticAnalysis": "UNASSESSED",
      "gapDescription": "UNASSESSED",
      "discrepancyIds": [],
      "recommendedDisposition": "UNASSESSED",
      "assessedBy": "UNASSIGNED",
      "reviewedBy": "UNASSIGNED",
      "assessmentDate": "2026-07-19T15:54:56Z"
    },
    {
      "assessmentId": "REQA-JAN-REQ-GOV-007",
      "requirementId": "JAN-REQ-GOV-007",
      "applicability": "APPLICABILITY_UNKNOWN",
      "conformanceStatus": "UNKNOWN",
      "assessmentConfidence": "UNKNOWN",
      "currentImplementationSummary": "UNASSESSED",
      "implementationReferences": [],
      "testReferences": [],
      "runtimeEvidenceReferences": [],
      "evidenceIds": [],
      "semanticAnalysis": "UNASSESSED",
      "gapDescription": "UNASSESSED",
      "discrepancyIds": [],
      "recommendedDisposition": "UNASSESSED",
      "assessedBy": "UNASSIGNED",
      "reviewedBy": "UNASSIGNED",
      "assessmentDate": "2026-07-19T15:54:56Z"
    },
    {
      "assessmentId": "REQA-JAN-REQ-GOV-008",
      "requirementId": "JAN-REQ-GOV-008",
      "applicability": "APPLICABILITY_UNKNOWN",
      "conformanceStatus": "UNKNOWN",
      "assessmentConfidence": "UNKNOWN",
      "currentImplementationSummary": "UNASSESSED",
      "implementationReferences": [],
      "testReferences": [],
      "runtimeEvidenceReferences": [],
      "evidenceIds": [],
      "semanticAnalysis": "UNASSESSED",
      "gapDescription": "UNASSESSED",
      "discrepancyIds": [],
      "recommendedDisposition": "UNASSESSED",
      "assessedBy": "UNASSIGNED",
      "reviewedBy": "UNASSIGNED",
      "assessmentDate": "2026-07-19T15:54:56Z"
    },
    {
      "assessmentId": "REQA-JAN-REQ-GOV-009",
      "requirementId": "JAN-REQ-GOV-009",
      "applicability": "APPLICABILITY_UNKNOWN",
      "conformanceStatus": "UNKNOWN",
      "assessmentConfidence": "UNKNOWN",
      "currentImplementationSummary": "UNASSESSED",
      "implementationReferences": [],
      "testReferences": [],
      "runtimeEvidenceReferences": [],
      "evidenceIds": [],
      "semanticAnalysis": "UNASSESSED",
      "gapDescription": "UNASSESSED",
      "discrepancyIds": [],
      "recommendedDisposition": "UNASSESSED",
      "assessedBy": "UNASSIGNED",
      "reviewedBy": "UNASSIGNED",
      "assessmentDate": "2026-07-19T15:54:56Z"
    },
    {
      "assessmentId": "REQA-JAN-REQ-GOV-010",
      "requirementId": "JAN-REQ-GOV-010",
      "applicability": "APPLICABILITY_UNKNOWN",
      "conformanceStatus": "UNKNOWN",
      "assessmentConfidence": "UNKNOWN",
      "currentImplementationSummary": "UNASSESSED",
      "implementationReferences": [],
      "testReferences": [],
      "runtimeEvidenceReferences": [],
      "evidenceIds": [],
      "semanticAnalysis": "UNASSESSED",
      "gapDescription": "UNASSESSED",
      "discrepancyIds": [],
      "recommendedDisposition": "UNASSESSED",
      "assessedBy": "UNASSIGNED",
      "reviewedBy": "UNASSIGNED",
      "assessmentDate": "2026-07-19T15:54:56Z"
    },
    {
      "assessmentId": "REQA-JAN-REQ-GOV-011",
      "requirementId": "JAN-REQ-GOV-011",
      "applicability": "APPLICABILITY_UNKNOWN",
      "conformanceStatus": "UNKNOWN",
      "assessmentConfidence": "UNKNOWN",
      "currentImplementationSummary": "UNASSESSED",
      "implementationReferences": [],
      "testReferences": [],
      "runtimeEvidenceReferences": [],
      "evidenceIds": [],
      "semanticAnalysis": "UNASSESSED",
      "gapDescription": "UNASSESSED",
      "discrepancyIds": [],
      "recommendedDisposition": "UNASSESSED",
      "assessedBy": "UNASSIGNED",
      "reviewedBy": "UNASSIGNED",
      "assessmentDate": "2026-07-19T15:54:56Z"
    },
    {
      "assessmentId": "REQA-JAN-REQ-GOV-012",
      "requirementId": "JAN-REQ-GOV-012",
      "applicability": "APPLICABILITY_UNKNOWN",
      "conformanceStatus": "UNKNOWN",
      "assessmentConfidence": "UNKNOWN",
      "currentImplementationSummary": "UNASSESSED",
      "implementationReferences": [],
      "testReferences": [],
      "runtimeEvidenceReferences": [],
      "evidenceIds": [],
      "semanticAnalysis": "UNASSESSED",
      "gapDescription": "UNASSESSED",
      "discrepancyIds": [],
      "recommendedDisposition": "UNASSESSED",
      "assessedBy": "UNASSIGNED",
      "reviewedBy": "UNASSIGNED",
      "assessmentDate": "2026-07-19T15:54:56Z"
    },
    {
      "assessmentId": "REQA-JAN-REQ-GOV-013",
      "requirementId": "JAN-REQ-GOV-013",
      "applicability": "APPLICABILITY_UNKNOWN",
      "conformanceStatus": "UNKNOWN",
      "assessmentConfidence": "UNKNOWN",
      "currentImplementationSummary": "UNASSESSED",
      "implementationReferences": [],
      "testReferences": [],
      "runtimeEvidenceReferences": [],
      "evidenceIds": [],
      "semanticAnalysis": "UNASSESSED",
      "gapDescription": "UNASSESSED",
      "discrepancyIds": [],
      "recommendedDisposition": "UNASSESSED",
      "assessedBy": "UNASSIGNED",
      "reviewedBy": "UNASSIGNED",
      "assessmentDate": "2026-07-19T15:54:56Z"
    },
    {
      "assessmentId": "REQA-JAN-REQ-GOV-014",
      "requirementId": "JAN-REQ-GOV-014",
      "applicability": "APPLICABILITY_UNKNOWN",
      "conformanceStatus": "UNKNOWN",
      "assessmentConfidence": "UNKNOWN",
      "currentImplementationSummary": "UNASSESSED",
      "implementationReferences": [],
      "testReferences": [],
      "runtimeEvidenceReferences": [],
      "evidenceIds": [],
      "semanticAnalysis": "UNASSESSED",
      "gapDescription": "UNASSESSED",
      "discrepancyIds": [],
      "recommendedDisposition": "UNASSESSED",
      "assessedBy": "UNASSIGNED",
      "reviewedBy": "UNASSIGNED",
      "assessmentDate": "2026-07-19T15:54:56Z"
    },
    {
      "assessmentId": "REQA-JAN-REQ-SEM-001",
      "requirementId": "JAN-REQ-SEM-001",